objectid,title,creator,date,description,subject,location,identifier,type,format,language,rights,rightsstatement,display_template,object_location,image_small,image_thumb,image_alt_text
triptychinwalnuts,"""Triptych in Walnuts""",Gary L. Carlson,2010,"""Familiar paintings go nuts. Composition: wood, fabric, doll parts, walnuts, watercolor knock-offs, Velcro, pearl earring.""",Found-objects (Art),Side Show Metropolitan Museum,AG-01,Image;StillImage,image/jpeg,eng,"In Copyright - Educational Use Permitted. For more information, please contact lead archivist at MLK122@pitt.edu.",https://rightsstatements.org/page/InC-EDU/1.0/?language=en,image,https://www.artgutz.com/triptychinwalnuts.html,/objects/small/triptychinwalnuts.jpg,/objects/thumb/triptychinwalnuts.jpg,"A trio of famous paintings (Girl with a Pearl Earring, The Scream, and Mona Lisa) recreated with watercolors and walnut heads."
allyoucaneat,"""All You Can Eat""",Gary L. Carlson,2010,"""Gourmet dining awaits at the (far) corner table. Composition: black walnut, weather-stripping foam, forks, fabric, jackknife, measuring spoon, can top, PVC elbows (the shoes), cork, wood, posterboard.""",Found-objects (Art),Side Show Metropolitan Museum,AG-04,Image;StillImage,image/jpeg,eng,"In Copyright - Educational Use Permitted. For more information, please contact lead archivist at MLK122@pitt.edu.",https://rightsstatements.org/page/InC-EDU/1.0/?language=en,image,https://www.artgutz.com/allyoucaneat.html,/objects/small/allyoucaneat.jpg,/objects/thumb/allyoucaneat.jpg,"A walnut-headed figure waits eagerly for a meal in the corner of an all-you-can-eat diner, with a black-and-white checkered floor and half beige, half green walls."
quicksand,"""Quicksand""",Gary L. Carlson,2006,"""Heads above the surface but sinking fast display terror or resignation in a theatrical venue. Found-object art is my true love and discarded black walnut shells are about as found-object as you can get. (Although I have a grand[child] who does very nice things with rocks.) Composition: walnuts (chewed by squirrels), cat litter, glue, Crown Royal bag, bottle cap, silent movie-type placard.""",Found-objects (Art),Side Show Metropolitan Museum,AG-13,Image;StillImage,image/jpeg,eng,"In Copyright - Educational Use Permitted. For more information, please contact lead archivist at MLK122@pitt.edu.",https://rightsstatements.org/page/InC-EDU/1.0/?language=en,image,https://www.artgutz.com/quicksand.html,/objects/small/dquicksand.jpg,/objects/thumb/dquicksand.jpg,Walnut heads peer just above the surface of quicksand inside a traditional theatre venue.
enigmaticfigure,"""Untitled (Enigmatic Figure)""",Gary L. Carlson,2009,"""Enigmatic contemplation with a view. Composition: black walnut shell, reversed mink coat, calamine lotion bottle, rock. (A viewer once asked, 'Where did you get the rock?')""",Found-objects (Art),Side Show Metropolitan Museum,AG-25,Image;StillImage,image/jpeg,eng,"In Copyright - Educational Use Permitted. For more information, please contact lead archivist at MLK122@pitt.edu.",https://rightsstatements.org/page/InC-EDU/1.0/?language=enhts Statements,image,https://www.artgutz.com/enigmaticfigure.html,/objects/small/enigmaticfigure.jpg,/objects/thumb/enigmaticfigure.jpg,"Enigmatic, walnut-headed figure stands contemplating the view from atop a rock."
judgmentday,"""Judgment Day""",Gary L. Carlson,2010,"""Most of us have either been frightened by or miffed off at the prospect of being judged by a bunch of people who don’t really know us at all. Their institutions may be weighty with tradition and authority but are easily represented in paper, cardboard and walnuts. Composition: cardboard box, posterboard, wood, wood pegs, construction paper, PVC pipe, clock picture, black walnuts, popsicle sticks.""",Found-objects (Art),Side Show Metropolitan Museum,AG-26,Image;StillImage,image/jpeg,eng,"In Copyright - Educational Use Permitted. For more information, please contact lead archivist at MLK122@pitt.edu.",https://rightsstatements.org/page/InC-EDU/1.0/?language=enhts Statements,image,https://www.artgutz.com/judgmentday.html,/objects/small/judgmentday.jpg,/objects/thumb/judgmentday.jpg,Walnut-headed jurors wait in the shadowy inside of a white courthouse.